[{"acceptedConceptGuid":null,"acceptedConceptName":null,"author":"Meisn.","classs":"Equisetopsida","commonName":"Poker Grevillea","conservationStatus":{},"family":"Proteaceae","genus":"Grevillea","guid":"http://id.biodiversity.org.au/node/apni/2918016","highlight":null,"idxType":"TAXON","image":"60f49ea3-4b48-4893-b8d7-1817d93047a7","imageMetadataUrl":"dc","imageUrl":null,"kingdom":"Plantae","largeImageUrl":"60f49ea3-4b48-4893-b8d7-1817d93047a7","linkIdentifier":null,"name":"Grevillea petrophiloides","nameComplete":"Grevillea petrophiloides Meisn.","order":"Proteales","parentGuid":"http://id.biodiversity.org.au/node/apni/3855393","phylum":"Charophyta","rank":"species","rankId":7000,"score":2.9588866,"smallImageUrl":"60f49ea3-4b48-4893-b8d7-1817d93047a7","taxonomicStatus":"accepted","thumbnailUrl":"60f49ea3-4b48-4893-b8d7-1817d93047a7"}]